source,url,date,time,title,body,summary,keywords,image_url,contains_keyword,clean_body
The Guardian,https://www.theguardian.com/politics/ng-interactive/2024/jun/28/how-the-unforced-error-of-tory-austerity-wrecked-britain,2024-06-28,05:00:13 UTC,How the ‘unforced error’ of austerity wrecked Britain,"View image in fullscreen Composite: Guardian Design Team/Getty

Unless the polls are wildly inaccurate, the Conservative party is heading towards a catastrophic defeat in the coming election.

All across the rich world, voters are angry at their governments – they blame politicians for a burst of inflation that happened almost everywhere and is now subsiding almost everywhere, including in the UK. But the Conservatives deserve defeat more than most: they took power 14 years ago promising to deliver responsible policies and economic success. Instead they have presided over economic stagnation and a collapse in public services.

Why has Conservative governance gone so badly? It is natural to blame Brexit, which did indeed increase trade frictions and therefore surely had a negative effect on British real income. However, Brexit has not had the disastrous effects some predicted, and has somewhat perversely led to a rise rather than a fall in immigration, especially of the highly skilled.

In fact, the roots of Britain’s poor economic performance are older and deeper than Brexit. Though many bad decisions undoubtedly contributed, one central cause was the way David Cameron and George Osborne gratuitously embraced fiscal austerity when they came to power after the global financial crisis.

At the time, this looked like an obvious macroeconomic error; more than a decade later, it has become a social and political catastrophe.

Let us recall the circumstances when the Conservatives took power. The financial crisis had produced a severe global recession; by 2010 the world economy was growing again, but all major economies, Britain included, were still operating far below capacity and had high unemployment.

Textbook economics tells us that when unemployment is high and inflation is low, governments should try to stimulate demand with reduced interest rates and fiscal deficits. Interest cuts were not an option because rates were already close to zero, so the indicated policy was fiscal stimulus.

Yet the Cameron government chose to do the opposite, pulling back fiscal support from an economy that still needed it badly. Britain was not the only nation turning to fiscal austerity in the face of high unemployment – Greece engaged in savage austerity, while Portugal, Spain, Italy and Ireland made large cuts, and fiscal policy in the US also turned contractionary.

What made the British case unique was that it was almost entirely an unforced error. Southern European austerity was a response to pressure from the bond markets: Greece was in effect cut off from private markets, while other nations faced sharply increased borrowing costs, becoming dependent on official lenders who insisted on budget cuts as a condition for loans. Bond buyers never lost faith in the US, but after 2010 Barack Obama faced a deeply hostile Congress, which in effect blackmailed him into spending cuts by threatening to provoke a government default.

While Britain had low borrowing costs like the US, its government was not divided. The Cameron executive could have chosen to maintain spending. Why did it turn to austerity?

Part of the answer is that policymakers were genuinely spooked by the sudden emergence of the crisis in Greece. Until Greece hit the wall, debt crises were generally thought of as a problem that happened only in poorer nations. It is understandable that many observers, at least initially, wondered if the Greek crisis was the leading edge of a broader attack by bond vigilantes.

But UK debt was clearly far smaller relative to the economy than Greece’s – and it became obvious early on that contagion from the Greek debt crisis was restricted to eurozone nations. So there was no reason to continue believing that the UK risked “becoming Greece”, as many politicians recklessly claimed at the time.

In fact, it soon became clear that even the eurozone crisis was more a matter of market panic than one of fundamentally unsustainable levels of debt. As the economist Paul De Grauwe has said, nations with debts in another country’s currency can suffer something similar to a bank run: panicked investors seeking to pull out their funds can cause a government to run out of cash, forcing it into default. Nations that borrow in their own currency are not vulnerable to such a self-fulfilling crisis, because they can in effect print money in a crunch.

This analysis was validated in 2012 when Mario Draghi, the president of the European Central Bank (ECB), said three words: “Whatever it takes.” This was taken to mean that the ECB would, if necessary, supply cash to governments facing a market panic. And suddenly the euro “debt” crisis faded away, with investors demanding much lower interest rates on the debt of Italy, Spain and so on.

Since Britain has not adopted the euro and had debts in its own currency, it was not vulnerable to this kind of cash crisis.

The bottom line is that there was no pressing economic need to slash spending in the face of high unemployment. I would argue that the best way to explain Britain’s austerity is not economic but sociological.

Sociology? I used to talk about the push for austerity being led by Very Serious People (a term I borrowed from the blogger Duncan Black). This was not really a joke: if you spend any time consorting with members of the global policy elite, you realise that many of them are driven primarily by the desire to appear “serious”. In economic terms, this usually means pushing policies that will cause significant hardship – to other people, of course.

The obsession with perceived seriousness reflects peer pressure, but in some ways also reflects personal careerism. Officials in democratic nations cannot expect to remain in office for more than a few years. What do they do next? If they have lobbied for “serious” policies, they can have a bright future giving speeches at Davos about the importance of making “tough choices”. Or they might even end up employed by the financial industry to lobby their former colleagues – where a reputation for “seriousness” is a prerequisite, no matter how much damage those policies have caused. (Indeed, Osborne has done both.)

Sociology partly explains the Conservative embrace of austerity. But there was also political calculation. Denunciations of debt and deficits often go hand in hand with demands for smaller government, in particular a shrunken welfare state. In effect, politicians whose real goal is to move policy to the right exploit fear of deficits to push an agenda that would be deeply unpopular if stated openly. The Oxford economist Simon Wren-Lewis calls this the “deficit deceit” hypothesis. The deceit aspect is especially obvious in the US, where Republican leaders routinely denounce deficits while pushing for budget-busting tax cuts. But there is every reason to believe that the same kind of cynicism played an important role in UK austerity.

It turns out, however, that exploiting debt fears to engineer cuts in public spending tends not to work out quite the way that small-government advocates hope.

What serious conservatives – they do exist – want is a less generous social safety net, with fewer income transfers to households, while governments concentrate on those functions that only government can perform. I do not share that desire, but never mind. What is important is that voters do not share that desire: cutting direct financial aid is deeply unpopular.

What does this have to do with deficit deceit? Even when a government manages to build support for spending cuts by scaring the public about debt and deficits, it generally finds itself shying away from spending cuts that will directly affect families’ incomes. Instead, it tries to save money by shortchanging public investment and public services, a strategy that seems preferable because the consequences of these spending cuts may not be all that visible in the short run.

But the effects of inadequate public investment cumulate over time, so that a fiscal strategy advertised as an exercise in responsibility ends up being deeply irresponsible, leading to crumbling infrastructure and deteriorating public services. This is how Cameron and Osborne’s error has compounded over the past decade.

Consider the NHS. I am clearly not an expert on the system, and I am sure that the NHS’s problems have multiple causes. But it is obvious to an outsider that direct public provision of healthcare, while it has major advantages, creates a special form of political vulnerability.

Compare the NHS with single-payer systems – including Medicare, which serves older Americans – in which the government pays the bills but does not employ the doctors or operate the hospitals. An attempt to save money by underfunding Medicare would provoke an immediate public outcry – in fact, false rumours of such a move created an outcry in 2010. But a government can underfund the NHS for years before the consequences become obvious to voters, and by that time the crisis can be very hard to fix.

To sum up: a decade ago, the main critique of austerity was macroeconomic – it was holding back recovery from the severe recession that followed the global financial crisis. And it did. But that was not the end of the story. Austerity also gradually undermined public services, including healthcare.

What will a Labour government do to reverse this damage? There are two reasons to worry it will fall short.

First, the era of Conservative austerity coincided with an era of low interest rates and substantial excess capacity, exactly the conditions under which Britain should have been investing in its future. The current environment is much less favourable.

Second, Labour’s stated plans lack any ambition to reverse austerity. In the US, the Biden administration came in with bold plans and managed to accomplish a significant fraction of them despite having only a razor-thin congressional majority. I am not hearing anything comparable from Labour, even though Keir Starmer seems on course to have political capital beyond the wildest dreams of US progressives.

I hope to be proved wrong. But right now it looks as though the shadow of austerity policies adopted in error 14 years ago will continue to darken Britain’s prospects for many years to come.","Though many bad decisions undoubtedly contributed, one central cause was the way David Cameron and George Osborne gratuitously embraced fiscal austerity when they came to power after the global financial crisis.
Britain was not the only nation turning to fiscal austerity in the face of high unemployment – Greece engaged in savage austerity, while Portugal, Spain, Italy and Ireland made large cuts, and fiscal policy in the US also turned contractionary.
What made the British case unique was that it was almost entirely an unforced error.
And suddenly the euro “debt” crisis faded away, with investors demanding much lower interest rates on the debt of Italy, Spain and so on.
But right now it looks as though the shadow of austerity policies adopted in error 14 years ago will continue to darken Britain’s prospects for many years to come.","['cuts', 'britain', 'wrecked', 'economic', 'error', 'policies', 'nations', 'unforced', 'crisis', 'debt', 'austerity', 'public', 'spending', 'fiscal']",https://i.guim.co.uk/img/media/926fdf4daeea34c2e4f0479cbe92eb3c9593d1b9/0_0_3848_2308/master/3848.jpg?width=1200&height=630&quality=85&auto=format&fit=crop&overlay-align=bottom%2Cleft&overlay-width=100p&overlay-base64=L2ltZy9zdGF0aWMvb3ZlcmxheXMvdGctZGVmYXVsdC5wbmc&enable=upscale&s=2686c548c3c1b2f4bcc8f93ce7b61474,True,view imag fullscreen composit guardian design teamgetti unless poll wild inaccur conserv parti head toward catastroph defeat come elect across rich world voter angri govern - blame politician burst inflat happen almost everywher subsid almost everywher includ uk conserv deserv defeat most took power year ago promis deliv respons polici econom success instead presid econom stagnat collaps public servic conserv govern gone bad natur blame brexit inde increas trade friction therefor sure negat effect british real incom howev brexit disastr effect predict somewhat pervers led rise rather fall immigr especi high skill fact root britain 's poor econom perform older deeper brexit though mani bad decis undoubt contribut one central caus way david cameron georg osborn gratuit embrac fiscal auster came power global financi crisi time look like obvious macroeconom error decad later becom social polit catastroph let us recal circumst conserv took power financi crisi produc sever global recess world economi grow again major economi britain includ still oper far capac high unemploy textbook econom tell us unemploy high inflat low govern tri stimul demand reduc interest rate fiscal deficit interest cut option rate alreadi close zero indic polici fiscal stimulus yet cameron govern chose opposit pull back fiscal support economi still need bad britain nation turn fiscal auster face high unemploy - greec engag savag auster portug spain itali ireland made larg cut fiscal polici us also turn contractionari made british case uniqu almost entir unforc error southern european auster respons pressur bond market greec effect cut privat market nation face sharpli increas borrow cost becom depend offici lender insist budget cut condit loan bond buyer never lost faith us barack obama face deepli hostil congress effect blackmail spend cut threaten provok govern default britain low borrow cost like us govern divid cameron execut could chosen maintain spend turn auster part answer policymak genuin spook sudden emerg crisi greec greec hit wall debt crise general thought problem happen poorer nation understand mani observ least initi wonder greek crisi lead edg broader attack bond vigilant uk debt clear far smaller relat economi greec 's - becam obvious earli contagion greek debt crisi restrict eurozon nation reason continu believ uk risk `` becom greec '' mani politician reckless claim time fact soon becam clear even eurozon crisi matter market panic one fundament unsustain level debt economist paul de grauw said nation debt anoth countri 's currenc suffer someth similar bank run panick investor seek pull fund caus govern run cash forc default nation borrow currenc vulner selffulfil crisi effect print money crunch analysi valid mario draghi presid european central bank ecb said three word `` whatev take '' taken mean ecb would necessari suppli cash govern face market panic sudden euro `` debt '' crisi fade away investor demand much lower interest rate debt itali spain on sinc britain adopt euro debt currenc vulner kind cash crisi bottom line press econom need slash spend face high unemploy would argu best way explain britain 's auster econom sociolog sociolog use talk push auster led serious peopl a term borrow blogger duncan black realli joke spend time consort member global polici elit realis mani driven primarili desir appear `` serious '' econom term usual mean push polici caus signific hardship - peopl cours obsess perceiv serious reflect peer pressur way also reflect person career offici democrat nation can not expect remain offic year next lobbi `` serious '' polici bright futur give speech davo import make `` tough choic '' might even end employ financi industri lobbi former colleagu - reput `` serious '' prerequisit matter much damag polici caus inde osborn done both sociolog part explain conserv embrac auster also polit calcul denunci debt deficit often go hand hand demand smaller govern particular shrunken welfar state effect politician whose real goal move polici right exploit fear deficit push agenda would deepli unpopular state open oxford economist simon wrenlewi call `` deficit deceit '' hypothesi deceit aspect especi obvious us republican leader routin denounc deficit push budgetbust tax cut everi reason believ kind cynic play import role uk auster turn out howev exploit debt fear engin cut public spend tend work quit way smallgovern advoc hope serious conserv - exist - want less generous social safeti net fewer incom transfer household govern concentr function govern perform share desir never mind import voter share desir cut direct financi aid deepli unpopular deficit deceit even govern manag build support spend cut scare public debt deficit general find shi away spend cut direct affect famili ' incom instead tri save money shortchang public invest public servic strategi seem prefer consequ spend cut may visibl short run effect inadequ public invest cumul time fiscal strategi advertis exercis respons end deepli irrespons lead crumbl infrastructur deterior public servic cameron osborn 's error compound past decad consid nhs clear expert system sure nhs 's problem multipl caus obvious outsid direct public provis healthcar major advantag creat special form polit vulner compar nhs singlepay system - includ medicar serv older american - govern pay bill employ doctor oper hospit attempt save money underfund medicar would provok immedi public outcri - fact fals rumour move creat outcri govern underfund nhs year consequ becom obvious voter time crisi hard fix sum up decad ago main critiqu auster macroeconom - hold back recoveri sever recess follow global financi crisi did end stori auster also gradual undermin public servic includ healthcar labour govern revers damag two reason worri fall short first era conserv auster coincid era low interest rate substanti excess capac exact condit britain invest futur current environ much less favour second labour 's state plan lack ambit revers auster us biden administr came bold plan manag accomplish signific fraction despit razorthin congression major hear anyth compar labour even though keir starmer seem cours polit capit beyond wildest dream us progress hope prove wrong right look though shadow auster polici adopt error year ago continu darken britain 's prospect mani year come
