source,url,date,time,title,body,summary,keywords,image_url,contains_keyword,clean_body
CNBC,https://www.cnbc.com/2024/06/30/democrats-defend-biden-debate-flop-voter-poll.html,2024-06-30,16:58:10 UTC,'Preparation overload': Democrats defend Biden after debate flop as voter support flinches,"Democrat candidate, U.S. President Joe Biden, and Republican candidate, former U.S. President Donald Trump, attend a presidential debate in Atlanta, Georgia, U.S., June 27, 2024.

Democrats are making the rounds on the Sunday media circuit working to reshape perceptions about President Joe Biden after he delivered a stumbling debate performance that left his voters cringing and his party in a damage-control frenzy.

""Yes, it was a bad performance,"" South Carolina's Democratic Rep. Jim Clyburn, a close Biden ally, said on CNN's ""State of the Union."" ""I know when I see what I call preparation overload. And that's exactly what was going on the other night.""

The South Carolina Democrat followed the post-debate spin formula that has emerged from Biden supporters since the Thursday showdown: Acknowledge the fumble and then pivot to critiques of the presumptive Republican presidential nominee, former President Donald Trump.

""Joe Biden should continue to run on his record. I do believe that we will find him when contrasted with the record of the four years of Trump to be exactly what we need going forward,"" Clyburn said.

Former presidents Barack Obama and Bill Clinton followed that structure in similar arguments on Friday.

House Democratic Leader Hakeem Jeffries, Sen. Chris Coons, D-Del., Sen. Raphael Warnock, D-Ga. and former House Speaker Nancy Pelosi, D-Calif., also jumped to Biden's defense on the Sunday media junket.

Despite the full-court press, Biden's Thursday debate performance, marked by several instances where he tripped over his words or trailed off mid-answer, has only amplified voter concerns about his age and fitness to carry out a second presidential term.

A new CBS News/YouGov poll taken between June 28 and June 29 found that 72% of registered voters surveyed do not think Biden should run for president, up from 63% in February. The poll also found that 72% of the respondents do not think that Biden has the mental and cognitive ability to serve as president, a seven percent increase since June 9.

A poll taken so shortly after a major event like Thursday's debate represents a knee-jerk reaction. A more accurate snapshot of public sentiment may emerge as the initial hype dies down and voters have more time to process. The CBS News poll surveyed 1,130 registered voters and had a margin of error of +/- 4.2%.

But those new numbers come in direct tension with Biden's argument that voters are not as down on his debate blunders as much as political pundits.

""I understand the concern about the debate. I get it. I didn't have a great night. But here's what [is] not getting reported: Voters had a different reaction than the pundits,"" the president said at a Saturday campaign event in East Hampton, N.Y. ""Since the debate, polls show a little movement, and we've moved us up, actually.""

Biden and Trump are scheduled for a second debate on Sept. 10, though it is unclear whether both candidates will follow through.

Ultimately, the debate has triggered a Democratic reckoning over whether Biden should remain the presumptive nominee.

Some Democratic strategists, along with newspaper editorial boards across the country have suggested he should step down and forfeit his delegates ahead of August's Democratic National Convention to allow someone else to take on Trump in November.

Biden is at Camp David on Sunday, joined by his family where he is expected to discuss the path forward of his reelection bid, according to NBC News.

In the meantime, the Biden campaign has been raking in large fundraising hauls in the wake of the debate. As of Sunday morning, the campaign had raised $33 million since Thursday, $26 million of which came from grassroots donors, according to Biden campaign spokesperson Kevin Munoz.

Munoz added that nearly half of that grassroots funding came from donors giving money to the campaign for the first time this election season.","Democrat candidate, U.S. President Joe Biden, and Republican candidate, former U.S. President Donald Trump, attend a presidential debate in Atlanta, Georgia, U.S., June 27, 2024.
""Yes, it was a bad performance,"" South Carolina's Democratic Rep. Jim Clyburn, a close Biden ally, said on CNN's ""State of the Union.""
Biden and Trump are scheduled for a second debate on Sept. 10, though it is unclear whether both candidates will follow through.
In the meantime, the Biden campaign has been raking in large fundraising hauls in the wake of the debate.
As of Sunday morning, the campaign had raised $33 million since Thursday, $26 million of which came from grassroots donors, according to Biden campaign spokesperson Kevin Munoz.","['preparation', 'biden', 'democrats', 'voters', 'presidential', 'campaign', 'performance', 'democratic', 'voter', 'president', 'debate', 'poll', 'flop', 'overload', 'flinches', 'support', 'defend', 'trump']",https://image.cnbcfm.com/api/v1/image/107434659-17195434712024-06-28t022629z_429775739_hp1ek6s06s2mv_rtrmadp_0_usa-election-debate.jpeg?v=1719543492&w=1920&h=1080,True,democrat candid us presid joe biden republican candid former us presid donald trump attend presidenti debat atlanta georgia us june democrat make round sunday media circuit work reshap percept presid joe biden deliv stumbl debat perform left voter cring parti damagecontrol frenzi yes bad perform south carolina democrat rep jim clyburn close biden alli said cnns state union i know see call prepar overload that exact go night south carolina democrat follow postdeb spin formula emerg biden support sinc thursday showdown acknowledg fumbl pivot critiqu presumpt republican presidenti nomine former presid donald trump joe biden continu run record believ find contrast record four year trump exact need go forward clyburn said former presid barack obama bill clinton follow structur similar argument friday hous democrat leader hakeem jeffri sen chris coon ddel sen raphael warnock dga former hous speaker nanci pelosi dcalif also jump biden defens sunday media junket despit fullcourt press biden thursday debat perform mark sever instanc trip word trail midansw amplifi voter concern age fit carri second presidenti term new cbs newsyougov poll taken june june found regist voter survey think biden run presid februari poll also found respond think biden mental cognit abil serv presid seven percent increas sinc june poll taken short major event like thursday debat repres kneejerk reaction accur snapshot public sentiment may emerg initi hype die voter time process cbs news poll survey regist voter margin error new number come direct tension biden argument voter debat blunder much polit pundit i understand concern debat get it great night here is get report voter differ reaction pundit presid said saturday campaign event east hampton ny sinc debat poll show littl movement weve move us up actual biden trump schedul second debat sept though unclear whether candid follow through ultim debat trigger democrat reckon whether biden remain presumpt nomine democrat strategist along newspap editori board across countri suggest step forfeit deleg ahead august democrat nation convent allow someon els take trump novemb biden camp david sunday join famili expect discuss path forward reelect bid accord nbc news meantim biden campaign rake larg fundrais haul wake debat sunday morn campaign rais million sinc thursday million came grassroot donor accord biden campaign spokesperson kevin munoz munoz ad near half grassroot fund came donor give money campaign first time elect season
CNBC,https://www.cnbc.com/2024/06/29/obama-clinton-excuse-biden-trump-debate.html,2024-06-29,14:36:53 UTC,"Obama, Clinton excuse Biden's debate performance to fend off Democratic meltdown: 'Bad debate nights happen'","Former US President Barack Obama (L) and former US President Bill Clinton (R) cheer for US President Joe Biden during a campaign fundraising event at Radio City Music Hall in New York City on March 28, 2024.

Former Presidents Barack Obama and Bill Clinton on Friday tried to do some damage control following President Joe Biden's debate fumble against his November election opponent, former President Donald Trump.

""Bad debate nights happen. Trust me, I know. But this election is still a choice between someone who has fought for ordinary folks his entire life and someone who only cares about himself,"" Obama said in a post on X, linking to Biden's campaign website. ""Last night didn't change that, and it's why so much is at stake in November.""

Several hours later, Clinton mimicked the defensive play.

""I'll leave the debate rating to the pundits, but here's what I know: facts and history matter,"" Clinton said in his own post on X, following with a brief list of Biden's accomplishments.

Throughout the 90-minute showdown on Thursday, Biden regularly stumbled, taking mid-sentence pauses to gather his words and tripping over his sentences. The blunders happened even on topics like abortion and the economy, which he tends to be cogent on during campaign rallies and White House events.

The messaging from Obama and Clinton marks a shift in strategy for Democrats as they try to course-correct after Thursday's flop.

Much of Democrats' spin immediately following the debate attempted to play down Biden's conspicuous blunders, instead attacking Trump's performance and giving Biden a generous evaluation.

""As the night went on, I think [Biden] really kind of rose to the occasion,"" Biden co-campaign chair Mitch Landrieu told NBC News Thursday night after the debate. ""I'm proud of the fact that he stood up to Donald Trump.""

The comments from Obama and Clinton represent a new tact: Acknowledge the debate disaster and then tell the public not to focus on it.

Biden himself followed that framing on Friday during a rally in North Carolina: ""Folks, I don't walk as easily as I used to. I don't speak as smoothly as I used to. I don't debate as well as I used to. But I know what I do know: I know how to tell the truth.""

But debates do matter to voters. After the September 2020 debate, a slew of polls found that voters thought Biden did a better job, which helped him maintain his lead against Trump.

This year's presidential race has been a near dead-heat so far and will likely be won by tight margins come November, leaving little room for error.

In the days since the debate, Democrats have been concerned about how it might weigh on voter perceptions, which are already rife with worries about Biden's age and fitness to lead the country for another four years.

Some Democratic strategists, donors and pundits have already suggested that Biden should drop out of the race and reopen the Democratic field to potentially stronger candidates.

The Biden campaign has so far rejected that proposal. Biden and Trump are scheduled to face off at a second and final debate on Sept. 10.","Former Presidents Barack Obama and Bill Clinton on Friday tried to do some damage control following President Joe Biden's debate fumble against his November election opponent, former President Donald Trump.
The messaging from Obama and Clinton marks a shift in strategy for Democrats as they try to course-correct after Thursday's flop.
The comments from Obama and Clinton represent a new tact: Acknowledge the debate disaster and then tell the public not to focus on it.
But I know what I do know: I know how to tell the truth.""
The Biden campaign has so far rejected that proposal.","['clinton', 'biden', 'bidens', 'campaign', 'used', 'performance', 'happen', 'fend', 'democratic', 'nights', 'obama', 'president', 'night', 'debate', 'excuse', 'meltdown', 'know']",https://image.cnbcfm.com/api/v1/image/107394635-1711681520374-gettyimages-2113298549-AFP_34MR3VT.jpeg?v=1711681571&w=1920&h=1080,True,former us presid barack obama l former us presid bill clinton r cheer us presid joe biden campaign fundrais event radio citi music hall new york citi march former presid barack obama bill clinton friday tri damag control follow presid joe biden debat fumbl novemb elect oppon former presid donald trump bad debat night happen trust me know elect still choic someon fought ordinari folk entir life someon care himself obama said post x link biden campaign websit last night chang that much stake novemb sever hour later clinton mimick defens play ill leav debat rate pundit here know fact histori matter clinton said post x follow brief list biden accomplish throughout minut showdown thursday biden regular stumbl take midsent paus gather word trip sentenc blunder happen even topic like abort economi tend cogent campaign ralli white hous event messag obama clinton mark shift strategi democrat tri coursecorrect thursday flop much democrat spin immedi follow debat attempt play biden conspicu blunder instead attack trump perform give biden generous evalu as night went on think biden realli kind rose occas biden cocampaign chair mitch landrieu told nbc news thursday night debat im proud fact stood donald trump comment obama clinton repres new tact acknowledg debat disast tell public focus it biden follow frame friday ralli north carolina folk walk easili use to speak smooth use to debat well use to know know know tell truth debat matter voter septemb debat slew poll found voter thought biden better job help maintain lead trump year presidenti race near deadheat far like tight margin come novemb leav littl room error day sinc debat democrat concern might weigh voter percept alreadi rife worri biden age fit lead countri anoth four year democrat strategist donor pundit alreadi suggest biden drop race reopen democrat field potenti stronger candid biden campaign far reject propos biden trump schedul face second final debat sept
