source,url,date,time,title,body,summary,keywords,image_url,contains_keyword,clean_body
CBN,https://www1.cbn.com/cbnnews/israel/2024/june/netanyahus-office-denies-reports-hell-support-palestinian-state-as-pm-makes-lebanon-border-tour,2024-06-27,09:15:25 UTC,Will Netanyahu Support a Palestinian State in Address to Congress?,"JERUSALEM, Israel – There are media reports that Israeli Prime Minister Benjamin Netanyahu may be about to abandon his opposition to a Palestinian state next to Israel. That news comes as top Israeli leaders visited the border with Lebanon where war could break out any day.

Aides to the prime minister have reportedly told the White House that when Netanyahu addresses a joint session of Congress in July, he'll present a new take on achieving a pathway to a Palestinian state. That would be a huge shift.

Yet those reports may be wrong. The Prime Minister's Office told The Times of Israel that Netanyahu ""opposes a Palestinian state and will not change his position in his address to Congress.""

The prime minister has consistently opposed Palestinian statehood in recent years, as poll after poll shows a huge majority of West Bank Palestinians themselves don't want a state next to Israel. They just want Israel destroyed.

Itamar Marcus, director of Palestinian Media Watch, points out most Palestinians hail the murderous attacks on Israelis, including what happened on October 7th.

""There's tremendous support within the West Bank for what happened on October 7th,"" Marcus stated. ""There was a poll taken a month and a half after October 7th – and everyone knew what happened, everybody knew about the rape and the destruction and the massacres – and Palestinians were asked 'With everything that's happened up till now, does it make you proud as a Palestinian?' And 98 percent of Palestinians said it made them proud.""

Preparing for War with Hezbollah & US Weapons Delays

On another front, both Netanyahu and Israeli President Isaac Herzog toured Israel's northern border with Lebanon this week. That's where all-out war may soon come, as the Jewish nation seeks to end daily attacks from Hezbollah on Israeli communities along the border.

In Washington, Israel's Defense Minister Yoav Gallant has supposedly made progress in speeding up shipments of weapons to the U.S. from Israel.

Netanyahu has accused the Biden administration of deliberately slow-walking such shipments.

For the first time, the U.S. administration is admitting there have been bottlenecks in getting some of those weapons shipped.

Gallant addressed Americans, saying Israel needs the U.S. by its side. ""The powerful and enduring bond between the United States and Israel is key to our nation's strategy and our security,"" the defense minister said.

Pennsylvania Sen. John Fetterman has been one Democrat particularly strong in supporting Israel's war with Hamas as others have wavered. He's met with Netanyahu on his first visit here. ""We stand with Israel through this and I'm so sorry for what's been done to this nation,"" Fetterman declared.

Turkey's President Recep Tayyip Erdogan pledged that his nation will stand with Hezbollah if it comes to war. He's condemning Western nations for backing Netanyahu, whose mental fitness he questioned. Erdogan asserted, ""It is extremely bad and pathetic that governments that talk about freedom, human rights, and justice are captives of a mentally ill person like Netanyahu.""

Antisemitism in NYC

In New York City, a masked man who demanded Jews get off a subway car earlier this month faces criminal charges of attempted coercion. He had yelled, ""Raise your hands if you're a Zionist – this is your chance to get out!""

Earlier this week, several dozen people protested against Manhattan District Attorney Alvin Bragg for his refusal to prosecute most of the anti-Israel demonstrators who illegally occupied Columbia University's Hamilton Hall this spring.

One protester said of Bragg, ""He's either a coward or an antisemite.""

***Please sign up for CBN Newsletters and download the CBN News app to ensure you keep receiving the latest news from a distinctly Christian perspective.***","JERUSALEM, Israel – There are media reports that Israeli Prime Minister Benjamin Netanyahu may be about to abandon his opposition to a Palestinian state next to Israel.
Aides to the prime minister have reportedly told the White House that when Netanyahu addresses a joint session of Congress in July, he'll present a new take on achieving a pathway to a Palestinian state.
The Prime Minister's Office told The Times of Israel that Netanyahu ""opposes a Palestinian state and will not change his position in his address to Congress.""
The prime minister has consistently opposed Palestinian statehood in recent years, as poll after poll shows a huge majority of West Bank Palestinians themselves don't want a state next to Israel.
Itamar Marcus, director of Palestinian Media Watch, points out most Palestinians hail the murderous attacks on Israelis, including what happened on October 7th.","['israel', 'palestinians', 'israeli', 'war', 'happened', 'netanyahu', 'congress', 'support', 'prime', 'address', 'palestinian', 'minister', 'state']",https://www2.cbn.com/sites/default/files/media/slider/images/ap24173723291219.jpg,True,jerusalem israel - media report isra prime minist benjamin netanyahu may abandon opposit palestinian state next israel news come top isra leader visit border lebanon war could break day aid prime minist report told white hous netanyahu address joint session congress juli hell present new take achiev pathway palestinian state would huge shift yet report may wrong prime minist offic told time israel netanyahu oppos palestinian state chang posit address congress prime minist consist oppos palestinian statehood recent year poll poll show huge major west bank palestinian want state next israel want israel destroy itamar marcus director palestinian media watch point palestinian hail murder attack isra includ happen octob th there tremend support within west bank happen octob th marcus state there poll taken month half octob th - everyon knew happen everybodi knew rape destruct massacr - palestinian ask with everyth that happen till now make proud palestinian percent palestinian said made proud prepar war hezbollah us weapon delay anoth front netanyahu isra presid isaac herzog tour israel northern border lebanon week that allout war may soon come jewish nation seek end daili attack hezbollah isra communiti along border washington israel defens minist yoav gallant suppos made progress speed shipment weapon us israel netanyahu accus biden administr deliber slowwalk shipment first time us administr admit bottleneck get weapon ship gallant address american say israel need us side the power endur bond unit state israel key nation strategi secur defens minist said pennsylvania sen john fetterman one democrat particular strong support israel war hama other waver hes met netanyahu first visit here we stand israel im sorri what done nation fetterman declar turkey presid recep tayyip erdogan pledg nation stand hezbollah come war hes condemn western nation back netanyahu whose mental fit question erdogan assert it extrem bad pathet govern talk freedom human right justic captiv mental ill person like netanyahu antisemit nyc new york citi mask man demand jew get subway car earlier month face crimin charg attempt coercion yell rais hand zionist - chanc get out earlier week sever dozen peopl protest manhattan district attorney alvin bragg refus prosecut antiisrael demonstr illeg occupi columbia univers hamilton hall spring one protest said bragg hes either coward antisemit pleas sign newslett download news app ensur keep receiv latest news distinct christian perspect
CBN,https://www1.cbn.com/cbnnews/us/2024/june/isis-network-helped-400-cross-us-border-illegally-many-of-them-are-now-missing,2024-06-26,16:10:36 UTC,ISIS Network Helped 400 Cross US Border Illegally - Many of Them Are Now Missing,"ISIS Network Helped 400 Cross US Border Illegally - Many of Them Are Now Missing

The Department of Homeland Security is searching for hundreds of ISIS-related ""subjects of concern"" who crossed the southern U.S. border illegally.

The DHS says more than 400 migrants came into the U.S. from Central Asia through a smuggling network affiliated with the Islamic terrorist group referred to as ISIS. Only about 150 have been arrested while others are reportedly being tracked across 17 states.

However, the whereabouts of more than 50 of those suspects are unknown.

Most of the ISIS-connected individuals who crossed the border were allowed to stay because they were not on a terrorism watch list, according to NBC News.

READ FBI Arrests 18-Year-Old in ISIS Plot to Murder American Churchgoers

House Committee on Homeland Security Chairman Mark E. Green, MD (R-TN) recently released a statement saying, ""Almost weekly we are getting reports that someone with terrorist ties or other major criminal connections has been released into our country by the Biden administration and allowed to roam free for months or even years.""

""It's only a matter of time before one of these individuals connected to a terrorist group is involved in something devastating on U.S. soil, and this administration will be responsible. How much longer will we let this madness continue?"" Green asked.

***Please sign up for CBN Newsletters and download the CBN News app to ensure you keep receiving the latest news from a Christian perspective.***

Recent attacks in Russia, such as this weekend's assault on churches and synagogues in the republic of Dagestan, have raised concerns about the terror group ISIS and its offshoots spreading abroad.

Earlier this month, federal agents revealed they had arrested eight people in several U.S. cities with alleged ties to ISIS.

Federal agencies released a joint statement saying, ""The individuals arrested are detained in ICE custody pending removal proceedings … The FBI and DHS will continue working around the clock with our partners to identify, investigate, and disrupt potential threats to national security.""

READ ICE Arrests 8 Migrants with Suspected Ties to ISIS Who Crossed the Border Illegally Last Year

MORE BORDER TROUBLE:

* Illegal Alien Accused of Child-Rape, Captured in NYC by Heroic Citizens Who Bravely Tackled Him

* 2 Venezuelans Caught and Released Near US Border Accused of Assaulting, Killing 12-Year-Old Girl

* FL Strike Team Begins Rescuing Sex Trafficking Victims Exploited by Migrant Smugglers

* BORDER CRISIS: Texas Gov. Greg Abbott Sits Down with CBN News in Exclusive Interview","ISIS Network Helped 400 Cross US Border Illegally - Many of Them Are Now MissingThe Department of Homeland Security is searching for hundreds of ISIS-related ""subjects of concern"" who crossed the southern U.S. border illegally.
The DHS says more than 400 migrants came into the U.S. from Central Asia through a smuggling network affiliated with the Islamic terrorist group referred to as ISIS.
Most of the ISIS-connected individuals who crossed the border were allowed to stay because they were not on a terrorism watch list, according to NBC News.
***Recent attacks in Russia, such as this weekend's assault on churches and synagogues in the republic of Dagestan, have raised concerns about the terror group ISIS and its offshoots spreading abroad.
Earlier this month, federal agents revealed they had arrested eight people in several U.S. cities with alleged ties to ISIS.","['crossed', 'cbn', 'cross', 'illegally', 'missing', 'arrested', 'network', 'isis', 'border', '400', 'released', 'terrorist', 'individuals', 'helped', 'group', 'ties']",https://www2.cbn.com/sites/default/files/media/slider/images/borderpatrolmigrantap.jpg,True,isi network help cross us border illeg mani miss depart homeland secur search hundr isisrel subject concern cross southern us border illeg dhs say migrant came us central asia smuggl network affili islam terrorist group refer isi arrest other report track across state howev whereabout suspect unknown isisconnect individu cross border allow stay terror watch list accord nbc news read fbi arrest yearold isi plot murder american churchgoer hous committe homeland secur chairman mark e green md rtn recent releas statement say almost week get report someon terrorist tie major crimin connect releas countri biden administr allow roam free month even year it matter time one individu connect terrorist group involv someth devast us soil administr respons much longer let mad continu green ask pleas sign newslett download news app ensur keep receiv latest news christian perspect recent attack russia weekend assault church synagogu republ dagestan rais concern terror group isi offshoot spread abroad earlier month feder agent reveal arrest eight peopl sever us citi alleg tie isi feder agenc releas joint statement say the individu arrest detain ice custodi pend remov proceed ... fbi dhs continu work around clock partner identifi investig disrupt potenti threat nation secur read ice arrest migrant suspect tie isi cross border illeg last year border troubl illeg alien accus childrap captur nyc heroic citizen brave tackl venezuelan caught releas near us border accus assault kill yearold girl fl strike team begin rescu sex traffick victim exploit migrant smuggler border crisi texa gov greg abbott sit news exclus interview
Fortune,https://fortune.com/2024/06/30/us-deficit-outlook-debt-service-costs-treasury-bond-market-federal-reserve/,2024-06-30,22:20:29 UTC,"The U.S. deficit is nearly as big a Russia’s economy, and there’s a ‘vicious’ feedback loop that could make it worse","The presidential election has brought the issue of federal budget deficits back into the spotlight as markets weigh the impact of another Biden or Trump administration on government revenue and spending.

A week before this past Thursday’s presidential debate, the Congressional Budget Office updated its projections for U.S. debt and deficits.

The CBO’s new estimate for the fiscal 2024 deficit is now $1.9 trillion, up from its prior view for $1.6 trillion issued in February and up from the 2023 deficit of about $1.7 trillion.

While the 2024 figure falls short of the pandemic-era high of $3 trillion, a level of $1.9 trillion nearly matches Russia’s entire GDP, which the World Bank put at $2 trillion in 2023, making it the 11th biggest economy in the world.

Part of the reason for the increase in the projected 2024 deficit was to account for emergency spending that went to help Ukraine fight Russia, the CBO said. Other emergency appropriations went to Israel and U.S. allies in Asia.

Meanwhile, the U.S. deficit eclipses other major economies like Mexico’s ($1.79 trillion), Australia’s ($1.72 trillion), and South Korea’s ($1.71 trillion).

For now, financial markets have largely focused more on inflation data and when the Federal Reserve will cut rates. But that doesn’t mean the risks of a widening deficit and debt are absent.

Former New York Fed President Bill Dudley told Bloomberg TV on Wednesday that unsustainable trends always come to an end.

He also warned that the situation could go south quickly. For example, if bond markets start to balk at buying Treasuries, interest rates will go up to attract more demand. That leads to the government paying more for debt service costs, which then adds further to the deficit.

“So the feedback loop here can be quite vicious,” Dudley said. “The hard thing is to know the timing.”

He added that there’s less demand for U.S. Treasury bonds in certain corners of the global market because Western sanctions on Russia prompted other countries to diversify away from dollar-denominated assets.

In addition, debt that was issued at lower rates is now being rolled over to higher rates, so debt service costs are going up more rapidly than total debt, Dudley said.

The election and its aftermath could be catalysts. Amid a Wall Street Journal report that said Trump’s allies have drawn up plans to erode the Fed’s independence, an election victory could raise concerns the Fed will monetize U.S. debt by buying more Treasuries and stoking inflation.

To be sure, it wouldn’t be easy to gain control over the Fed as the regional bank presidents aren’t appointed by the White House and Fed governors have staggered terms, Dudley pointed out.

“That said, just the mere attempt to take control of the Fed, to diminish the Fed’s independence could be the spark that rattles markets,” he added.","The CBO’s new estimate for the fiscal 2024 deficit is now $1.9 trillion, up from its prior view for $1.6 trillion issued in February and up from the 2023 deficit of about $1.7 trillion.
Part of the reason for the increase in the projected 2024 deficit was to account for emergency spending that went to help Ukraine fight Russia, the CBO said.
Meanwhile, the U.S. deficit eclipses other major economies like Mexico’s ($1.79 trillion), Australia’s ($1.72 trillion), and South Korea’s ($1.71 trillion).
But that doesn’t mean the risks of a widening deficit and debt are absent.
In addition, debt that was issued at lower rates is now being rolled over to higher rates, so debt service costs are going up more rapidly than total debt, Dudley said.","['fed', 'trillion', 'rates', 'worse', 'feedback', 'dudley', 'went', 'loop', '2024', 'deficit', 'russias', 'debt', 'election', 'economy', 'vicious', 'nearly', 'markets', 'big', 'theres']","https://fortune.com/img-assets/wp-content/uploads/2024/06/GettyImages-1387175767-e1719780528102.jpg?resize=1200,600",True,presidenti elect brought issu feder budget deficit back spotlight market weigh impact anoth biden trump administr govern revenu spend week past thursday 's presidenti debat congression budget offic updat project us debt deficit cbo 's new estim fiscal deficit trillion prior view trillion issu februari deficit trillion figur fall short pandemicera high trillion level trillion near match russia 's entir gdp world bank put trillion make th biggest economi world part reason increas project deficit account emerg spend went help ukrain fight russia cbo said emerg appropri went israel us alli asia meanwhil us deficit eclips major economi like mexico 's trillion australia 's trillion south korea 's trillion now financi market larg focus inflat data feder reserv cut rate doe n't mean risk widen deficit debt absent former new york fed presid bill dudley told bloomberg tv wednesday unsustain trend alway come end also warn situat could go south quick exampl bond market start balk buy treasuri interest rate go attract demand lead govern pay debt servic cost add deficit `` so feedback loop quit vicious '' dudley said `` the hard thing know time '' ad there 's less demand us treasuri bond certain corner global market western sanction russia prompt countri diversifi away dollardenomin asset addit debt issu lower rate roll higher rate debt servic cost go rapid total debt dudley said elect aftermath could catalyst amid wall street journal report said trump 's alli drawn plan erod fed 's independ elect victori could rais concern fed monet us debt buy treasuri stoke inflat sure would n't easi gain control fed region bank presid are n't appoint white hous fed governor stagger term dudley point out `` that said mere attempt take control fed diminish fed 's independ could spark rattl market '' ad
